{
  "impact_map_version": "AR-P003-v0.3-methodology-impact-map-v0.2",
  "protocol_version": "v0.3-draft-2026-09-21-primary-endpoint-v0.1",
  "ledger_version": "AR-P003-v0.3-methodology-decisions-v0.2",
  "status": "decision_support_only_no_selection",
  "decisions": [
    {
      "decision_id": "comparison_conditions",
      "candidates": [
        {
          "candidate_id": "two_condition_current",
          "implementation_class": "current_native",
          "impacted_artifacts": [
            "benchmark/arp003_v0_3/protocol.json",
            "benchmark/arp003_v0_3/generate_assignment.py",
            "benchmark/arp003_v0_3/build_runner_bundles.py",
            "benchmark/arp003_v0_3/offline_runner.html"
          ],
          "required_before_execution": [
            "explicit rationale for choosing two conditions",
            "crossed-design planning under the chosen two-condition estimand"
          ],
          "notes": "Matches the current development runner. It directly estimates the effect of adding the Receipt to underlying evidence, but does not separately identify the effect of generic evidence structuring."
        },
        {
          "candidate_id": "three_condition_structured_control",
          "implementation_class": "requires_versioned_change",
          "impacted_artifacts": [
            "benchmark/arp003_v0_3/protocol.json",
            "benchmark/arp003_v0_3/generate_assignment.py",
            "benchmark/arp003_v0_3/runner-bundle.schema.json",
            "benchmark/arp003_v0_3/runner-analysis.schema.json",
            "benchmark/arp003_v0_3/build_runner_bundles.py",
            "benchmark/arp003_v0_3/offline_runner.html",
            "benchmark/arp003_v0_3/merge_runner_responses.py",
            "benchmark/arp003_v0_3/score_responses.py",
            "benchmark/arp003_v0_3/plan_crossed_design.py"
          ],
          "required_before_execution": [
            "new versioned three-condition protocol/assignment contract",
            "neutral structured event-table renderer derived from the same canonical record/evidence",
            "evidence-symmetry audit across raw/table/Receipt presentations",
            "new crossed-design planning for R-vs-structured and structured-vs-raw contrasts"
          ],
          "notes": "Implements the research-review recommendation intended to separate generic evidence organization from Receipt-specific presentation. This is a material methodology change, not a cosmetic runner edit."
        }
      ]
    },
    {
      "decision_id": "primary_endpoint",
      "candidates": [
        {
          "candidate_id": "component_endpoint_set",
          "implementation_class": "current_native",
          "impacted_artifacts": [
            "benchmark/arp003_v0_3/response-record.schema.json",
            "benchmark/arp003_v0_3/score_responses.py",
            "docs/AR-P003-V0.3-PROTOCOL.md"
          ],
          "required_before_execution": [
            "freeze a small prespecified primary endpoint set",
            "freeze multiplicity/claim-gate handling",
            "freeze component-level estimands and denominator rules"
          ],
          "notes": "The current scorer already preserves action/source/incident F1 and categorical reconstruction outcomes. The final confirmatory primary set is still unresolved."
        },
        {
          "candidate_id": "correct_completion_by_180s",
          "implementation_class": "requires_versioned_change",
          "impacted_artifacts": [
            "benchmark/arp003_v0_3/protocol.json",
            "benchmark/arp003_v0_3/runner-build-config.schema.json",
            "benchmark/arp003_v0_3/runner-bundle.schema.json",
            "benchmark/arp003_v0_3/runner-response.schema.json",
            "benchmark/arp003_v0_3/runner-analysis.schema.json",
            "benchmark/arp003_v0_3/response-record.schema.json",
            "benchmark/arp003_v0_3/offline_runner.html",
            "benchmark/arp003_v0_3/build_runner_bundles.py",
            "benchmark/arp003_v0_3/merge_runner_responses.py",
            "benchmark/arp003_v0_3/score_responses.py",
            "benchmark/arp003_v0_3/plan_crossed_design.py",
            "benchmark/arp003_v0_3/pipeline_smoke_test.py"
          ],
          "required_before_execution": [
            "freeze required judgments and acceptable evidence sets per final sealed case",
            "select and freeze primary_timing_clock before confirmatory freeze",
            "enforce and test the 180-second deadline rule under the frozen timing clock",
            "preserve material-fact and unsupported-authorization failure semantics",
            "preserve critical false clearance as a separate safety endpoint",
            "replan crossed-design power for the binary primary estimand after effect_precision_target is selected"
          ],
          "notes": "Selected by the owner on 2026-09-21. Versioned development contracts implement the binary endpoint and case-specific judgment/support representation. Both wall and active clocks remain recorded, primary_timing_clock remains explicitly unresolved, and confirmatory primary-outcome derivation fails closed until that separate decision is selected. Component outcomes remain secondary and critical false clearance remains separate."
        }
      ]
    },
    {
      "decision_id": "primary_timing_clock",
      "candidates": [
        {
          "candidate_id": "active_time_primary",
          "implementation_class": "current_native",
          "impacted_artifacts": [
            "benchmark/arp003_v0_3/offline_runner.html",
            "benchmark/arp003_v0_3/runner-response.schema.json",
            "benchmark/arp003_v0_3/merge_runner_responses.py"
          ],
          "required_before_execution": [
            "freeze manual-pause and visibility-pause eligibility rules",
            "freeze technical-failure exclusion rules",
            "verify timing behavior in allowed browsers/devices"
          ],
          "notes": "The development runner already records active time and pause/visibility events. Selecting it remains a preregistration decision rather than an implementation default."
        },
        {
          "candidate_id": "wall_deadline_with_hidden_sensitivity",
          "implementation_class": "requires_versioned_change",
          "impacted_artifacts": [
            "benchmark/arp003_v0_3/protocol.json",
            "benchmark/arp003_v0_3/offline_runner.html",
            "benchmark/arp003_v0_3/merge_runner_responses.py",
            "benchmark/arp003_v0_3/score_responses.py"
          ],
          "required_before_execution": [
            "freeze wall/deadline semantics",
            "prespecify hidden-time threshold and sensitivity analysis",
            "preserve last answer state at timeout",
            "flag reload/timer-context breaks",
            "verify timing behavior in allowed browsers/devices"
          ],
          "notes": "Matches the research-review recommendation that background time remain in the primary deadline, with >10 seconds hidden handled as a prespecified sensitivity analysis. The runner already preserves wall and visibility data, so development observability is retained."
        }
      ]
    },
    {
      "decision_id": "challenge_design",
      "candidates": [
        {
          "candidate_id": "integrated_challenge_strata",
          "implementation_class": "current_native",
          "impacted_artifacts": [
            "benchmark/arp003_v0_3/protocol.json",
            "benchmark/arp003_v0_3/runner-analysis.schema.json",
            "benchmark/arp003_v0_3/generate_assignment.py",
            "benchmark/arp003_v0_3/plan_crossed_design.py"
          ],
          "required_before_execution": [
            "freeze challenge-stratum counts and balancing",
            "freeze separate ordinary/challenge reporting",
            "complete leakage and manual methodology review on final cases"
          ],
          "notes": "Selected by the project owner on 2026-09-21. The architecture is current-native: stale/incomplete/conflicting challenge cases stay inside the broader three-condition crossed study and ordinary/challenge results remain separate. Versioned protocol/analysis/scoring/planning bindings make the explicit selection machine-visible, while final stratum counts/allocation and final-corpus review remain unresolved."
        },
        {
          "candidate_id": "separate_robustness_cohort",
          "implementation_class": "requires_versioned_change",
          "impacted_artifacts": [
            "benchmark/arp003_v0_3/protocol.json",
            "benchmark/arp003_v0_3/generate_assignment.py",
            "benchmark/arp003_v0_3/runner-analysis.schema.json",
            "benchmark/arp003_v0_3/build_runner_bundles.py",
            "benchmark/arp003_v0_3/plan_crossed_design.py"
          ],
          "required_before_execution": [
            "fresh robustness families/episodes",
            "separate cohort allocation and randomization",
            "faithful-Receipt and corrupted-Receipt conditions",
            "freeze corruption families and eligible critical-false-clearance subset",
            "separate power/precision plan"
          ],
          "notes": "Matches the research-review recommendation for a distinct misleading-Receipt experiment. It materially changes sampling, assignment, prevalence, and interpretation and therefore requires a new versioned cohort plan."
        }
      ]
    },
    {
      "decision_id": "reviewer_population",
      "candidates": [
        {
          "candidate_id": "population_to_be_selected",
          "implementation_class": "scope_decision",
          "impacted_artifacts": [
            "docs/AR-P003-V0.3-PROTOCOL.md",
            "docs/AR-P003-V0.3-REVIEWER-INSTRUCTIONS-DRAFT.md",
            "benchmark/arp003_v0_3/plan_crossed_design.py"
          ],
          "required_before_execution": [